{
  "$schema": "https://json-schema.org/draft/2020-12/schema",
  "$id": "https://webuildconsortium.eu/schemas/control-attestation/0.9.0/control-attestation-schema.json",
  "title": "Control Attestation",
  "description": "SD-JWT VC schema for the WeBuild Control Attestation (vct: eu.we-build:control:1). Provides a complete, verifiable representation of an entity's control structure, recording all natural persons, legal entities, and legal arrangements which have direct or indirect control over a legal entity. Compliant with AMLR 2024/1624.",
  "type": "object",
  "required": [
    "vct",
    "iss",
    "iat",
    "exp",
    "attestation_legal_category",
    "controller"
  ],
  "properties": {

    "vct": {
      "type": "string",
      "const": "eu.we-build:control:1",
      "description": "Verifiable Credential Type identifier. SHALL be the fixed string 'eu.we-build:control:1'."
    },

    "iss": {
      "type": "string",
      "description": "Issuer identifier (DID or URI) of the entity that issued this attestation.",
      "minLength": 1
    },

    "iat": {
      "type": "integer",
      "description": "Issued-at time as a Unix timestamp (seconds since epoch). SHALL be in the past.",
      "minimum": 0
    },

    "exp": {
      "type": "integer",
      "description": "Expiry time as a Unix timestamp (seconds since epoch). SHALL be greater than iat.",
      "minimum": 0
    },

    "jti": {
      "type": "string",
      "description": "Unique identifier for this credential instance (JWT ID).",
      "minLength": 1
    },

    "issuing_entity": {
      "type": "string",
      "description": "Identifier of the legal entity subject to the control disclosure obligation.",
      "minLength": 1
    },

    "attestation_legal_category": {
      "type": "string",
      "enum": ["EAA", "QEAA"],
      "description": "Legal category of this attestation per eIDAS 2. SHALL be 'EAA' (self-issued) or 'QEAA' (issued by a QTSP or authorised competent body). NOT selectively disclosable."
    },

    "schema_version": {
      "type": "string",
      "description": "Version of the schema used for this attestation.",
      "minLength": 1,
      "pattern": "^[0-9]+\\.[0-9]+\\.[0-9]+$"
    },

    "trust_anchor_url": {
      "type": "string",
      "format": "uri",
      "description": "URL where the trust anchor for verifying this attestation can be retrieved.",
      "minLength": 1
    },

    "controller": {
      "type": "array",
      "description": "Array of Controller entries. SHALL contain at least one entry. At least one entry SHALL be of type 'Person' to satisfy AML requirements.",
      "minItems": 1,
      "items": {
        "$ref": "#/$defs/Controller"
      }
    },

    "status": {
      "type": "object",
      "description": "Revocation status claim. MUST be present if the validity period is greater than 24 hours.",
      "required": [
        "type",
        "status_list_credential",
        "status_list_index",
        "status_purpose"
      ],
      "properties": {

        "type": {
          "type": "string",
          "const": "status-list",
          "description": "SHALL be 'status-list'."
        },

        "status_list_credential": {
          "type": "string",
          "format": "uri",
          "description": "URI of the Status List Credential document containing the status bitstring.",
          "minLength": 1
        },

        "status_list_index": {
          "type": "integer",
          "description": "Zero-based index into the status list bitstring corresponding to this credential.",
          "minimum": 0
        },

        "status_purpose": {
          "type": "string",
          "const": "revocation",
          "description": "SHALL be 'revocation'."
        }

      },
      "additionalProperties": false
    },

    "cnf": {
      "type": "object",
      "description": "Confirmation claim binding the credential to the holder's key material per RFC 7800.",
      "properties": {
        "jwk": {
          "type": "object",
          "description": "JSON Web Key of the holder.",
          "required": ["kty"],
          "properties": {
            "kty": { "type": "string" },
            "crv": { "type": "string" },
            "x":   { "type": "string" },
            "y":   { "type": "string" },
            "n":   { "type": "string" },
            "e":   { "type": "string" }
          },
          "additionalProperties": false
        }
      },
      "additionalProperties": false
    }

  },

  "additionalProperties": false,

  "$defs": {

    "Controller": {
      "type": "object",
      "title": "Controller",
      "description": "A single Controller entry representing a natural person, legal entity, or legal arrangement that exercises direct or indirect control over the subject legal entity.",
      "required": [
        "type",
        "jurisdiction",
        "address",
        "controls",
        "effective_date",
        "evidence"
      ],
      "properties": {

        "type": {
          "type": "string",
          "description": "Discriminator field determining which sub-object (person or entity) is present. SHALL be 'Person' or 'Entity'.",
          "enum": ["Person", "Entity"]
        },

        "jurisdiction": {
          "type": "string",
          "description": "Country of legal relevance for this controller entry. SHALL be a valid ISO 3166-1 alpha-2 country code.",
          "pattern": "^[A-Z]{2}$",
          "minLength": 2,
          "maxLength": 2
        },

        "person": {
          "$ref": "#/$defs/Person",
          "description": "Personal identity attributes. SHALL be present when type = 'Person'. SHALL be absent when type = 'Entity'."
        },

        "entity": {
          "$ref": "#/$defs/Entity",
          "description": "Legal entity or legal arrangement attributes. SHALL be present when type = 'Entity'. SHALL be absent when type = 'Person'."
        },

        "address": {
          "$ref": "#/$defs/Address",
          "description": "Address of the controller — residential for Person, registered for Entity."
        },

        "controls": {
          "$ref": "#/$defs/Controls",
          "description": "Object describing how control is exercised by this controller."
        },

        "effective_date": {
          "type": "string",
          "description": "Date when this control relationship became legally effective. SHALL be a valid ISO 8601 date (YYYY-MM-DD).",
          "format": "date",
          "pattern": "^[0-9]{4}-[0-9]{2}-[0-9]{2}$"
        },

        "evidence": {
          "type": "array",
          "description": "Supporting evidence substantiating the declared control. SHALL contain at least one entry.",
          "minItems": 1,
          "items": {
            "$ref": "#/$defs/Evidence"
          }
        }

      },
      "additionalProperties": false,
      "if": {
        "properties": {
          "type": { "const": "Person" }
        }
      },
      "then": {
        "required": ["person"],
        "properties": {
          "entity": { "not": {} }
        }
      },
      "else": {
        "required": ["entity"],
        "properties": {
          "person": { "not": {} }
        }
      }
    },

    "Person": {
      "type": "object",
      "title": "Person",
      "description": "Personal identity attributes of the natural person exercising control.",
      "required": [
        "first_name",
        "surname"
      ],
      "properties": {

        "first_name": {
          "type": "string",
          "description": "First name(s) of the natural person, including middle names where applicable. SHALL be non-empty.",
          "minLength": 1
        },

        "surname": {
          "type": "string",
          "description": "Surname(s) or family name(s) of the natural person. SHALL be non-empty.",
          "minLength": 1
        },

        "birth_date": {
          "type": "string",
          "description": "Date of birth of the natural person. SHALL be a valid ISO 8601 date (YYYY-MM-DD) in the past. Optional but SHOULD be included where available.",
          "format": "date",
          "pattern": "^[0-9]{4}-[0-9]{2}-[0-9]{2}$"
        }

      },
      "additionalProperties": false
    },

    "Entity": {
      "type": "object",
      "title": "Entity",
      "description": "Legal entity or legal arrangement exercising control. Further classified by category field.",
      "required": [
        "category",
        "name",
        "identifier",
        "jurisdiction",
        "form"
      ],
      "properties": {

        "category": {
          "type": "string",
          "description": "Classification of the entity controller. SHALL be 'legal_entity' or 'legal_arrangement'.",
          "enum": ["legal_entity", "legal_arrangement"]
        },

        "name": {
          "type": "string",
          "description": "Complete official registered name of the entity or legal arrangement. SHALL be non-empty.",
          "minLength": 1
        },

        "identifier": {
          "$ref": "#/$defs/EntityIdentifier",
          "description": "Formal identifiers for the entity. At least one sub-field (euid, lei, tax, or other) SHALL be present."
        },

        "jurisdiction": {
          "type": "string",
          "description": "ISO 3166-1 alpha-2 jurisdiction in which the entity is registered or legally domiciled. SHALL be non-empty.",
          "pattern": "^[A-Z]{2}$",
          "minLength": 2,
          "maxLength": 2
        },

        "form": {
          "type": "string",
          "description": "Legal form of the entity. SHALL use values from Section 2.8.6.",
          "enum": [
            "private_company",
            "public_company",
            "partnership",
            "limited_partnership",
            "trust",
            "foundation",
            "cooperative",
            "state_owned_enterprise",
            "other"
          ]
        },

        "subtype_info": {
          "$ref": "#/$defs/SubtypeInfo",
          "description": "Additional information mandatory when category = 'legal_arrangement' or form = 'trust'."
        }

      },
      "additionalProperties": false,
      "if": {
        "anyOf": [
          {
            "properties": {
              "category": { "const": "legal_arrangement" }
            }
          },
          {
            "properties": {
              "form": { "const": "trust" }
            }
          }
        ]
      },
      "then": {
        "required": ["subtype_info"]
      }
    },

    "EntityIdentifier": {
      "type": "object",
      "title": "EntityIdentifier",
      "description": "Formal identifiers for a legal entity or legal arrangement. At least one sub-field SHALL be present.",
      "properties": {

        "euid": {
          "type": "string",
          "description": "European Unique Identifier per Directive (EU) 2017/1132. Optional.",
          "minLength": 1
        },

        "lei": {
          "type": "string",
          "description": "Legal Entity Identifier per ISO 17442. 20-character alphanumeric code. Optional.",
          "pattern": "^[A-Z0-9]{18}[0-9]{2}$",
          "minLength": 20,
          "maxLength": 20
        },

        "tax": {
          "type": "string",
          "description": "National tax or registration number. Optional.",
          "minLength": 1
        },

        "other": {
          "type": "string",
          "description": "Any other applicable legal identifier. Optional.",
          "minLength": 1
        }

      },
      "additionalProperties": false,
      "minProperties": 1
    },

    "SubtypeInfo": {
      "type": "object",
      "title": "SubtypeInfo",
      "description": "Additional mandatory attributes for legal arrangements (trusts, foundations, etc.). Required when entity.category = 'legal_arrangement' or entity.form = 'trust'.",
      "required": [
        "settlement",
        "purpose",
        "assets"
      ],
      "properties": {

        "settlement": {
          "type": "string",
          "description": "The instrument or document establishing the legal arrangement (e.g., trust deed reference or description). SHALL be non-empty.",
          "minLength": 1
        },

        "purpose": {
          "type": "string",
          "description": "The declared purpose of the legal arrangement. SHALL be non-empty.",
          "minLength": 1
        },

        "assets": {
          "type": "string",
          "description": "Description of assets held within the legal arrangement. SHALL be non-empty.",
          "minLength": 1
        },

        "reason_for_registration": {
          "type": "string",
          "description": "The reason the legal arrangement was formally registered. Optional.",
          "minLength": 1
        }

      },
      "additionalProperties": false
    },

    "Address": {
      "type": "object",
      "title": "Address",
      "description": "Physical address of the controller — residential for Person, registered office for Entity.",
      "required": [
        "street",
        "house_number",
        "locality",
        "region",
        "postal_code",
        "country"
      ],
      "properties": {

        "street": {
          "type": "string",
          "description": "Street name of the address. SHALL be non-empty.",
          "minLength": 1
        },

        "house_number": {
          "type": "string",
          "description": "House or building number of the address. SHALL be non-empty.",
          "minLength": 1
        },

        "locality": {
          "type": "string",
          "description": "City or locality of the address. SHALL be non-empty.",
          "minLength": 1
        },

        "region": {
          "type": "string",
          "description": "State, province, or region of the address. SHALL be non-empty.",
          "minLength": 1
        },

        "postal_code": {
          "type": "string",
          "description": "Postal or ZIP code of the address. SHALL be non-empty.",
          "minLength": 1
        },

        "country": {
          "type": "string",
          "description": "Country of the address. SHALL be a valid ISO 3166-1 alpha-2 country code.",
          "pattern": "^[A-Z]{2}$",
          "minLength": 2,
          "maxLength": 2
        }

      },
      "additionalProperties": false
    },

    "Controls": {
      "type": "object",
      "title": "Controls",
      "description": "Object describing how and to what degree the controller exercises control over the subject entity.",
      "required": [
        "type",
        "level",
        "basis",
        "rights"
      ],
      "properties": {

        "type": {
          "type": "array",
          "description": "Array of control mechanism types. SHALL contain at least one value from Section 2.8.3. Multiple values MAY be present.",
          "minItems": 1,
          "items": {
            "type": "string",
            "enum": [
              "voting_rights",
              "appointment_rights",
              "agreements",
              "dominance",
              "other_means_of_control",
              "board",
              "veto",
              "contractual",
              "nominee",
              "profit_distribution"
            ],
            "description": "A single control mechanism type code from Section 2.8.3."
          },
          "uniqueItems": true
        },

        "level": {
          "type": "string",
          "description": "How the control is held. SHALL be one of: 'direct', 'indirect', 'joint', or 'unknown' as defined in Section 2.8.2.",
          "enum": ["direct", "indirect", "joint", "unknown"]
        },

        "basis": {
          "type": "string",
          "description": "Legal or structural basis for the control. SHALL use values from Section 2.8.4.",
          "enum": [
            "corporate_position",
            "shareholding",
            "contractual",
            "legal_framework",
            "trust_arrangement",
            "other"
          ]
        },

        "voting_percentage": {
          "type": ["number", "null"],
          "description": "Percentage of voting rights held by the controller (0–100). Optional.",
          "minimum": 0,
          "maximum": 100
        },

        "appointment_rights": {
          "type": "string",
          "description": "Free text details on appointment rights held by the controller. Optional.",
          "minLength": 1
        },

        "other_details": {
          "type": "string",
          "description": "Free text for other control mechanisms not captured by structured fields. Optional.",
          "minLength": 1
        },

        "rights": {
          "type": "array",
          "description": "Array of economic rights associated with the control. SHALL contain at least one value from Section 2.8.5.",
          "minItems": 1,
          "items": {
            "type": "string",
            "enum": [
              "dividend_rights",
              "liquidation_rights"
            ],
            "description": "An economic rights code from Section 2.8.5."
          },
          "uniqueItems": true
        }

      },
      "additionalProperties": false
    },

    "Evidence": {
      "type": "object",
      "title": "Evidence",
      "description": "Supporting evidence substantiating the declared control relationship. At least one entry SHALL be present per Controller.",
      "required": [
        "id",
        "type"
      ],
      "properties": {

        "id": {
          "type": "string",
          "description": "Unique identifier, URI, or URN of the source or evidence document. SHALL be non-empty.",
          "minLength": 1
        },

        "type": {
          "type": "string",
          "description": "Type of evidence document. SHALL use a value from Section 2.8.9.",
          "enum": [
            "officialRegister",
            "selfDeclaration",
            "thirdPartyVerification",
            "trustDeed",
            "shareholderAgreement",
            "articlesOfAssociation",
            "governanceChart"
          ]
        },

        "url": {
          "type": "string",
          "format": "uri",
          "description": "URI reference to the publicly accessible source or evidence document. Optional.",
          "minLength": 1
        },

        "data": {
          "type": "string",
          "description": "Base64-encoded source document. SHALL be provided if url is absent or not publicly accessible.",
          "contentEncoding": "base64",
          "minLength": 1
        }

      },
      "additionalProperties": false
    }

  }
}