{

  "vct": "eu.we-build:control:1",
  "attestation_legal_category": "EAA",
  "iss": "did:web:bosch.com",
  "iat": 1736935200,
  "exp": 1768471200,
  "jti": "urn:uuid:control-attestation-bosch-20260601-001",
  "issuing_entity": "did:web:bosch.com",
  "schema_version": "0.9.0",
  "trust_anchor_url": "https://trust.webuildconsortium.eu/anchors/eidas-tl",
  "controller": [
    {

      "type": "Person",

      "jurisdiction": "DE",

      "person": {
        "first_name": "Alice",
        "surname": "Smith",
        "birth_date": "1975-03-20"
      },

      "address": {
        "street": "Hauptstraße",
        "house_number": "10",
        "locality": "Berlin",
        "region": "Berlin",
        "postal_code": "10115",
        "country": "DE"
      },

      "controls": {
        "type": ["voting_rights", "board"],
        "level": "direct",
        "basis": "shareholding",
        "voting_percentage": 60.0,
        "appointment_rights": "Right to appoint majority of supervisory board per articles of association section 12",
        "rights": ["dividend_rights", "liquidation_rights"]
      },

      "effective_date": "2020-01-15",

      "evidence": [
        {
          "id": "src-ctrl-001",
          "type": "officialRegister",
          "url": "https://example.com/docs/shareholder-register-extract-2024.pdf"
        },
        {
          "id": "src-ctrl-002",
          "type": "articlesOfAssociation",
          "url": "https://example.com/docs/articles-of-association-2020.pdf"
        }
      ]
    },

    {

      "type": "Entity",

      "jurisdiction": "DE",

      "entity": {
        "category": "legal_entity",
        "name": "HoldCo GmbH",
        "identifier": {
          "euid": "DE-HRB-987654",
          "lei": "529900T8BM49AURSDO55",
          "tax": "DE123456789"
        },
        "jurisdiction": "DE",
        "form": "private_company"
      },

      "address": {
        "street": "Musterstraße",
        "house_number": "45",
        "locality": "Frankfurt",
        "region": "Hessen",
        "postal_code": "60311",
        "country": "DE"
      },

      "controls": {
        "type": ["nominee", "voting_rights"],
        "level": "indirect",
        "basis": "shareholding",
        "voting_percentage": 40.0,
        "other_details": "Shares held through nominee arrangement; ultimate beneficial owner identified separately in UBO attestation",
        "rights": ["dividend_rights"]
      },

      "effective_date": "2019-06-01",

      "evidence": [
        {
          "id": "src-ctrl-003",
          "type": "governanceChart",
          "url": "https://example.com/docs/group-governance-chart-2024.pdf"
        },
        {
          "id": "src-ctrl-004",
          "type": "shareholderAgreement",
          "url": "https://example.com/docs/nominee-shareholder-agreement-2019.pdf"
        }
      ]
    },

    {

      "type": "Entity",

      "jurisdiction": "LU",

      "entity": {
        "category": "legal_arrangement",
        "name": "Smith Family Trust",
        "identifier": {
          "lei": "549300ABCDEF12345678"
        },
        "jurisdiction": "LU",
        "form": "trust",
        "subtype_info": {
          "settlement": "Settled under Luxembourg trust law (Loi du 27 juillet 2003) on 2015-03-01 per trust deed reference LU-TD-2015-0042",
          "purpose": "Family wealth management, succession planning, and preservation of family business interests across generations",
          "assets": "Real estate portfolio (Luxembourg and Germany), securities portfolios (equity and fixed income), cash holdings, and 15% participation in HoldCo GmbH",
          "reason_for_registration": "Registered for tax transparency reporting under CRS and FATCA obligations"
        }
      },

      "address": {
        "street": "Rue de la Forêt",
        "house_number": "7",
        "locality": "Luxembourg City",
        "region": "Luxembourg",
        "postal_code": "L-1234",
        "country": "LU"
      },

      "controls": {
        "type": ["agreements", "other_means_of_control"],
        "level": "indirect",
        "basis": "trust_arrangement",
        "other_details": "Control exercised through trustee's legal title over trust assets including participation in HoldCo GmbH. Trustee has authority to vote shares, receive dividends, and direct disposal of assets per trust deed clause 8.",
        "rights": ["dividend_rights", "liquidation_rights"]
      },

      "effective_date": "2015-03-01",

      "evidence": [
        {
          "id": "src-ctrl-005",
          "type": "trustDeed",
          "url": "https://example.com/docs/smith-family-trust-deed-2015.pdf"
        },
        {
          "id": "src-ctrl-006",
          "type": "thirdPartyVerification",
          "url": "https://notary.example.lu/verification/trust-LU-TD-2015-0042"
        }
      ]
    }

  ],

  "status": {
    "type": "status-list",
    "status_list_credential": "https://trust.webuildconsortium.eu/status/control-list-2026-001",
    "status_list_index": 456,
    "status_purpose": "revocation"
  },

  "cnf": {
    "jwk": {
      "kty": "EC",
      "crv": "P-256",
      "x": "TCAER19Zvu3OHF4j4W4vfSVoHIP1ILilDls7vCeGemc",
      "y": "ZxjiWWbZMQGHVWKVQ4hbSIirsVfuecCE6t4jT9F2HZQ"
    }
  }
}